================================================================================
S7 RUN 016: SETTLING TIME ANALYSIS
Measuring ring-down behavior to find true steady-state drift
================================================================================
Time: 2025-12-10T08:21:52.064272
Provider: claude
Settling threshold: |delta_drift| < 0.1 for 3 consecutive
Max recovery probes: 12
Key offset: 9 (for parallel execution)
================================================================================

KEY POOL STATUS:
  ANTHROPIC   : 10 keys [OK]
  OPENAI      : 10 keys [OK]
  GOOGLE      : 10 keys [OK]
  XAI         : 10 keys [OK]

================================================================================
LOADING I_AM FILES
================================================================================
Testing 29 I_AM files: ['personas_base', 'personas_cfa', 'personas_claude', 'personas_gemini', 'personas_nova', 'personas_pan_handlers', 'personas_ziggy', 'personas_ziggy_full', 'personas_ziggy_lite', 'personas_ziggy_t3_r1', 'r015_all_pillars', 'r015_boundaries_only', 'r015_control', 'r015_full_synthetic', 'r015_high_density', 'r015_low_density', 'r015_minimal', 'r015_named_only', 'r015_optimal', 'r015_optimal_behavioral', 'r015_optimal_epistemic', 'r015_optimal_relational', 'r015_origin_only', 'r015_single_pillar_values', 'r015_synthetic_optimal', 'r015_values_only', 'si_boundaries_rich', 'si_full_si_model', 'si_narrative_rich']

================================================================================
SETTLING TIME EXPERIMENTS
================================================================================

  Testing: personas_base
    [baseline_1] drift=0.000
    [baseline_2] drift=0.467
    [baseline_3] drift=0.551
    [step_1] drift=1.780 (STEP INPUT)
    [recovery_1] drift=0.543
    [recovery_2] drift=0.582 d=0.039
    [recovery_3] drift=0.598 d=0.016
    [recovery_4] drift=0.607 SETTLED!
    -> Peak: 1.780, Settled: 0.596, tau_s: 4
    -> Classification: STABLE
    -> Monotonic: True, Ringbacks: 0
    [EXIT SURVEY] Skipped (--skip-exit-survey)

  Testing: personas_cfa
    [baseline_1] drift=0.000
    [baseline_2] drift=0.489
    [baseline_3] drift=0.572
    [step_1] drift=0.732 (STEP INPUT)
    [recovery_1] drift=0.692
    [recovery_2] drift=0.578 d=0.114
    [recovery_3] drift=0.738 d=0.160
    [recovery_4] drift=0.669 d=0.069
    [recovery_5] drift=0.752 d=0.084
    [recovery_6] drift=0.656 SETTLED!
    -> Peak: 0.752, Settled: 0.692, tau_s: 6
    -> Classification: STABLE
    -> Monotonic: False, Ringbacks: 4
    [EXIT SURVEY] Skipped (--skip-exit-survey)

  Testing: personas_claude
    [baseline_1] drift=0.000
    [baseline_2] drift=0.503
    [baseline_3] drift=0.547
    [step_1] drift=0.856 (STEP INPUT)
    [recovery_1] drift=0.550
    [recovery_2] drift=0.594 d=0.044
    [recovery_3] drift=0.525 d=0.069
    [recovery_4] drift=0.588 SETTLED!
    -> Peak: 0.856, Settled: 0.569, tau_s: 4
    -> Classification: STABLE
    -> Monotonic: False, Ringbacks: 2
    [EXIT SURVEY] Skipped (--skip-exit-survey)

  Testing: personas_gemini
    [baseline_1] drift=0.000
    [baseline_2] drift=0.423
    [baseline_3] drift=0.327
    [step_1] drift=0.747 (STEP INPUT)
    [recovery_1] drift=0.733
    [recovery_2] drift=0.674 d=0.059
    [recovery_3] drift=0.695 d=0.021
    [recovery_4] drift=0.703 SETTLED!
    -> Peak: 0.747, Settled: 0.690, tau_s: 4
    -> Classification: STABLE
    -> Monotonic: True, Ringbacks: 1
    [EXIT SURVEY] Skipped (--skip-exit-survey)

  Testing: personas_nova
    [baseline_1] drift=0.000
    [baseline_2] drift=0.517
    [baseline_3] drift=0.623
    [step_1] drift=0.949 (STEP INPUT)
    [recovery_1] drift=0.679
    [recovery_2] drift=0.810 d=0.131
    [recovery_3] drift=0.663 d=0.147
    [recovery_4] drift=0.727 d=0.064
    [recovery_5] drift=0.775 d=0.049
    [recovery_6] drift=0.758 SETTLED!
    -> Peak: 0.949, Settled: 0.753, tau_s: 6
    -> Classification: STABLE
    -> Monotonic: False, Ringbacks: 3
    [EXIT SURVEY] Skipped (--skip-exit-survey)

  Testing: personas_pan_handlers
    [baseline_1] drift=0.000
    [baseline_2] drift=0.501
    [baseline_3] drift=0.400
    [step_1] drift=0.810 (STEP INPUT)
    [recovery_1] drift=0.741
    [recovery_2] drift=0.593 d=0.148
    [recovery_3] drift=0.535 d=0.058
    [recovery_4] drift=0.548 d=0.013
    [recovery_5] drift=0.637 SETTLED!
    -> Peak: 0.810, Settled: 0.573, tau_s: 5
    -> Classification: STABLE
    -> Monotonic: True, Ringbacks: 1
    [EXIT SURVEY] Skipped (--skip-exit-survey)

  Testing: personas_ziggy
    [baseline_1] drift=0.000
    [baseline_2] drift=0.522
    [baseline_3] drift=0.487
    [step_1] drift=0.816 (STEP INPUT)
    [recovery_1] drift=0.529
    [recovery_2] drift=0.545 d=0.016
    [recovery_3] drift=0.604 d=0.059
    [recovery_4] drift=0.763 d=0.159
    [recovery_5] drift=0.572 d=0.191
    [recovery_6] drift=0.722 d=0.150
    [recovery_7] drift=0.688 d=0.034
    [recovery_8] drift=0.685 d=0.004
    [recovery_9] drift=0.729 SETTLED!
    -> Peak: 0.816, Settled: 0.701, tau_s: 9
    -> Classification: STABLE
    -> Monotonic: False, Ringbacks: 4
    [EXIT SURVEY] Skipped (--skip-exit-survey)

  Testing: personas_ziggy_full
    [baseline_1] drift=0.000
    [baseline_2] drift=0.592
    [baseline_3] drift=0.534
    [step_1] drift=0.945 (STEP INPUT)
    [recovery_1] drift=0.676
    [recovery_2] drift=0.720 d=0.043
    [recovery_3] drift=0.560 d=0.159
    [recovery_4] drift=0.722 d=0.161
    [recovery_5] drift=0.539 d=0.182
    [recovery_6] drift=0.573 d=0.034
    [recovery_7] drift=0.657 d=0.083
    [recovery_8] drift=0.700 SETTLED!
    -> Peak: 0.945, Settled: 0.643, tau_s: 8
    -> Classification: STABLE
    -> Monotonic: False, Ringbacks: 4
    [EXIT SURVEY] Skipped (--skip-exit-survey)

  Testing: personas_ziggy_lite
    [baseline_1] drift=0.000
    [baseline_2] drift=0.552
    [baseline_3] drift=0.475
    [step_1] drift=0.871 (STEP INPUT)
    [recovery_1] drift=0.570
    [recovery_2] drift=0.604 d=0.035
    [recovery_3] drift=0.615 d=0.011
    [recovery_4] drift=0.586 SETTLED!
    -> Peak: 0.871, Settled: 0.602, tau_s: 4
    -> Classification: STABLE
    -> Monotonic: True, Ringbacks: 1
    [EXIT SURVEY] Skipped (--skip-exit-survey)

  Testing: personas_ziggy_t3_r1
    [baseline_1] drift=0.000
    [baseline_2] drift=0.579
    [baseline_3] drift=0.600
    [step_1] drift=0.801 (STEP INPUT)
    [recovery_1] drift=0.841
    [recovery_2] drift=0.795 d=0.047
    [recovery_3] drift=0.708 d=0.087
    [recovery_4] drift=0.825 d=0.117
    [recovery_5] drift=0.714 d=0.111
    [recovery_6] drift=0.716 d=0.002
    [recovery_7] drift=0.726 d=0.010
    [recovery_8] drift=0.766 SETTLED!
    -> Peak: 0.841, Settled: 0.736, tau_s: 8
    -> Classification: STABLE
    -> Monotonic: False, Ringbacks: 3
    [EXIT SURVEY] Skipped (--skip-exit-survey)

  Testing: r015_all_pillars
    [baseline_1] drift=0.000
    [baseline_2] drift=0.391
    [baseline_3] drift=0.406
    [step_1] drift=0.743 (STEP INPUT)
    [recovery_1] drift=0.528
    [recovery_2] drift=0.580 d=0.052
    [recovery_3] drift=0.563 d=0.017
    [recovery_4] drift=0.653 SETTLED!
    -> Peak: 0.743, Settled: 0.599, tau_s: 4
    -> Classification: STABLE
    -> Monotonic: False, Ringbacks: 2
    [EXIT SURVEY] Skipped (--skip-exit-survey)

  Testing: r015_boundaries_only
    [baseline_1] drift=0.000
    [baseline_2] drift=0.462
    [baseline_3] drift=0.496
    [step_1] drift=0.862 (STEP INPUT)
    [recovery_1] drift=0.608
    [recovery_2] drift=0.748 d=0.139
    [recovery_3] drift=0.592 d=0.156
    [recovery_4] drift=0.713 d=0.121
    [recovery_5] drift=0.621 d=0.093
    [recovery_6] drift=0.680 d=0.060
    [recovery_7] drift=0.595 SETTLED!
    -> Peak: 0.862, Settled: 0.632, tau_s: 7
    -> Classification: STABLE
    -> Monotonic: False, Ringbacks: 5
    [EXIT SURVEY] Skipped (--skip-exit-survey)

  Testing: r015_control
    [baseline_1] drift=0.000
    [baseline_2] drift=0.376
    [baseline_3] drift=0.587
    [step_1] drift=1.068 (STEP INPUT)
    [recovery_1] drift=0.571
    [recovery_2] drift=0.512 d=0.060
    [recovery_3] drift=0.619 d=0.107
    [recovery_4] drift=0.694 d=0.075
    [recovery_5] drift=0.647 d=0.046
    [recovery_6] drift=0.591 SETTLED!
    -> Peak: 1.068, Settled: 0.644, tau_s: 6
    -> Classification: STABLE
    -> Monotonic: False, Ringbacks: 2
    [EXIT SURVEY] Skipped (--skip-exit-survey)

  Testing: r015_full_synthetic
    [baseline_1] drift=0.000
    [baseline_2] drift=0.428
    [baseline_3] drift=0.392
    [step_1] drift=0.893 (STEP INPUT)
    [recovery_1] drift=0.531
    [recovery_2] drift=0.539 d=0.008
    [recovery_3] drift=0.605 d=0.066
    [recovery_4] drift=0.595 SETTLED!
    -> Peak: 0.893, Settled: 0.580, tau_s: 4
    -> Classification: STABLE
    -> Monotonic: True, Ringbacks: 1
    [EXIT SURVEY] Skipped (--skip-exit-survey)

  Testing: r015_high_density
    [baseline_1] drift=0.000
    [baseline_2] drift=0.530
    [baseline_3] drift=0.528
    [step_1] drift=0.790 (STEP INPUT)
    [recovery_1] drift=0.625
    [recovery_2] drift=0.566 d=0.059
    [recovery_3] drift=0.647 d=0.081
    [recovery_4] drift=0.622 SETTLED!
    -> Peak: 0.790, Settled: 0.612, tau_s: 4
    -> Classification: STABLE
    -> Monotonic: False, Ringbacks: 2
    [EXIT SURVEY] Skipped (--skip-exit-survey)

  Testing: r015_low_density
    [baseline_1] drift=0.000
    [baseline_2] drift=0.441
    [baseline_3] drift=0.564
    [step_1] drift=0.986 (STEP INPUT)
    [recovery_1] drift=0.551
    [recovery_2] drift=0.611 d=0.060
    [recovery_3] drift=0.572 d=0.040
    [recovery_4] drift=0.565 SETTLED!
    -> Peak: 0.986, Settled: 0.583, tau_s: 4
    -> Classification: STABLE
    -> Monotonic: True, Ringbacks: 1
    [EXIT SURVEY] Skipped (--skip-exit-survey)

  Testing: r015_minimal
    [baseline_1] drift=0.000
    [baseline_2] drift=0.399
    [baseline_3] drift=0.353
    [step_1] drift=0.916 (STEP INPUT)
    [recovery_1] drift=0.534
    [recovery_2] drift=0.657 d=0.123
    [recovery_3] drift=0.639 d=0.018
    [recovery_4] drift=0.626 d=0.014
    [recovery_5] drift=0.556 SETTLED!
    -> Peak: 0.916, Settled: 0.607, tau_s: 5
    -> Classification: STABLE
    -> Monotonic: True, Ringbacks: 1
    [EXIT SURVEY] Skipped (--skip-exit-survey)

  Testing: r015_named_only
    [baseline_1] drift=0.000
    [baseline_2] drift=0.581
    [baseline_3] drift=0.519
    [step_1] drift=1.169 (STEP INPUT)
    [recovery_1] drift=0.692
    [recovery_2] drift=0.567 d=0.125
    [recovery_3] drift=0.524 d=0.043
    [recovery_4] drift=0.714 d=0.190
    [recovery_5] drift=0.617 d=0.097
    [recovery_6] drift=0.683 d=0.066
    [recovery_7] drift=0.591 SETTLED!
    -> Peak: 1.169, Settled: 0.630, tau_s: 7
    -> Classification: STABLE
    -> Monotonic: False, Ringbacks: 4
    [EXIT SURVEY] Skipped (--skip-exit-survey)

  Testing: r015_optimal
    [baseline_1] drift=0.000
    [baseline_2] drift=0.471
    [baseline_3] drift=0.479
    [step_1] drift=0.644 (STEP INPUT)
    [recovery_1] drift=0.581
    [recovery_2] drift=0.671 d=0.090
    [recovery_3] drift=0.608 d=0.062
    [recovery_4] drift=0.620 SETTLED!
    -> Peak: 0.671, Settled: 0.633, tau_s: 4
    -> Classification: STABLE
    -> Monotonic: False, Ringbacks: 2
    [EXIT SURVEY] Skipped (--skip-exit-survey)

  Testing: r015_optimal_behavioral
    [baseline_1] drift=0.000
    [baseline_2] drift=0.631
    [baseline_3] drift=0.566
    [step_1] drift=0.897 (STEP INPUT)
    [recovery_1] drift=0.579
    [recovery_2] drift=0.573 d=0.006
    [recovery_3] drift=0.580 d=0.007
    [recovery_4] drift=0.817 d=0.237
    [recovery_5] drift=0.638 d=0.179
    [recovery_6] drift=0.479 d=0.159
    [recovery_7] drift=0.568 d=0.089
    [recovery_8] drift=0.583 d=0.015
    [recovery_9] drift=0.583 SETTLED!
    -> Peak: 0.897, Settled: 0.578, tau_s: 9
    -> Classification: STABLE
    -> Monotonic: False, Ringbacks: 3
    [EXIT SURVEY] Skipped (--skip-exit-survey)

  Testing: r015_optimal_epistemic
    [baseline_1] drift=0.000
    [baseline_2] drift=0.483
    [baseline_3] drift=0.478
    [step_1] drift=0.923 (STEP INPUT)
    [recovery_1] drift=0.519
    [recovery_2] drift=0.568 d=0.049
    [recovery_3] drift=0.660 d=0.092
    [recovery_4] drift=0.569 SETTLED!
    -> Peak: 0.923, Settled: 0.599, tau_s: 4
    -> Classification: STABLE
    -> Monotonic: True, Ringbacks: 1
    [EXIT SURVEY] Skipped (--skip-exit-survey)

  Testing: r015_optimal_relational
    [baseline_1] drift=0.000
    [baseline_2] drift=0.614
    [baseline_3] drift=0.592
    [step_1] drift=0.797 (STEP INPUT)
    [recovery_1] drift=0.824
    [recovery_2] drift=0.763 d=0.062
    [recovery_3] drift=0.780 d=0.017
    [recovery_4] drift=0.734 SETTLED!
    -> Peak: 0.824, Settled: 0.759, tau_s: 4
    -> Classification: STABLE
    -> Monotonic: False, Ringbacks: 2
    [EXIT SURVEY] Skipped (--skip-exit-survey)

  Testing: r015_origin_only
    [baseline_1] drift=0.000
    [baseline_2] drift=0.604
    [baseline_3] drift=0.521
    [step_1] drift=0.806 (STEP INPUT)
    [recovery_1] drift=0.652
    [recovery_2] drift=0.785 d=0.133
    [recovery_3] drift=0.709 d=0.076
    [recovery_4] drift=0.666 d=0.043
    [recovery_5] drift=0.704 SETTLED!
    -> Peak: 0.806, Settled: 0.693, tau_s: 5
    -> Classification: STABLE
    -> Monotonic: False, Ringbacks: 2
    [EXIT SURVEY] Skipped (--skip-exit-survey)

  Testing: r015_single_pillar_values
    [baseline_1] drift=0.000
    [baseline_2] drift=0.543
    [baseline_3] drift=0.391
    [step_1] drift=0.786 (STEP INPUT)
    [recovery_1] drift=0.566
    [recovery_2] drift=0.570 d=0.004
    [recovery_3] drift=0.480 d=0.091
    [recovery_4] drift=0.632 d=0.152
    [recovery_5] drift=0.530 d=0.101
    [recovery_6] drift=0.634 d=0.103
    [recovery_7] drift=0.597 d=0.037
    [recovery_8] drift=0.529 d=0.067
    [recovery_9] drift=0.632 d=0.103
    [recovery_10] drift=0.580 d=0.052
    [recovery_11] drift=0.584 d=0.004
    [recovery_12] drift=0.585 SETTLED!
    -> Peak: 0.786, Settled: 0.583, tau_s: 12
    -> Classification: STABLE
    -> Monotonic: False, Ringbacks: 8
    [EXIT SURVEY] Skipped (--skip-exit-survey)

  Testing: r015_synthetic_optimal
    [baseline_1] drift=0.000
    [baseline_2] drift=0.546
    [baseline_3] drift=0.496
    [step_1] drift=0.656 (STEP INPUT)
    [recovery_1] drift=0.606
    [recovery_2] drift=0.677 d=0.071
    [recovery_3] drift=0.717 d=0.041
    [recovery_4] drift=0.651 SETTLED!
    -> Peak: 0.717, Settled: 0.681, tau_s: 4
    -> Classification: STABLE
    -> Monotonic: True, Ringbacks: 1
    [EXIT SURVEY] Skipped (--skip-exit-survey)

  Testing: r015_values_only
    [baseline_1] drift=0.000
    [baseline_2] drift=0.323
    [baseline_3] drift=0.429
    [step_1] drift=0.871 (STEP INPUT)
    [recovery_1] drift=0.632
    [recovery_2] drift=0.706 d=0.073
    [recovery_3] drift=0.662 d=0.043
    [recovery_4] drift=0.636 SETTLED!
    -> Peak: 0.871, Settled: 0.668, tau_s: 4
    -> Classification: STABLE
    -> Monotonic: True, Ringbacks: 1
    [EXIT SURVEY] Skipped (--skip-exit-survey)

  Testing: si_boundaries_rich
    [baseline_1] drift=0.000
    [baseline_2] drift=0.555
    [baseline_3] drift=0.581
    [step_1] drift=1.002 (STEP INPUT)
    [recovery_1] drift=0.593
    [recovery_2] drift=0.659 d=0.066
    [recovery_3] drift=0.568 d=0.091
    [recovery_4] drift=0.538 SETTLED!
    -> Peak: 1.002, Settled: 0.589, tau_s: 4
    -> Classification: STABLE
    -> Monotonic: True, Ringbacks: 1
    [EXIT SURVEY] Skipped (--skip-exit-survey)

  Testing: si_full_si_model
    [baseline_1] drift=0.000
    [baseline_2] drift=0.460
    [baseline_3] drift=0.487
    [step_1] drift=0.845 (STEP INPUT)
    [recovery_1] drift=0.635
    [recovery_2] drift=0.742 d=0.107
    [recovery_3] drift=0.552 d=0.189
    [recovery_4] drift=0.644 d=0.091
    [recovery_5] drift=0.553 d=0.090
    [recovery_6] drift=0.648 SETTLED!
    -> Peak: 0.845, Settled: 0.615, tau_s: 6
    -> Classification: STABLE
    -> Monotonic: False, Ringbacks: 4
    [EXIT SURVEY] Skipped (--skip-exit-survey)

  Testing: si_narrative_rich
    [baseline_1] drift=0.000
    [baseline_2] drift=0.558
    [baseline_3] drift=0.526
    [step_1] drift=0.696 (STEP INPUT)
    [recovery_1] drift=0.646
    [recovery_2] drift=0.619 d=0.027
    [recovery_3] drift=0.638 d=0.018
    [recovery_4] drift=0.745 d=0.107
    [recovery_5] drift=0.672 d=0.073
    [recovery_6] drift=0.595 d=0.077
    [recovery_7] drift=0.653 SETTLED!
    -> Peak: 0.745, Settled: 0.640, tau_s: 7
    -> Classification: STABLE
    -> Monotonic: False, Ringbacks: 3
    [EXIT SURVEY] Skipped (--skip-exit-survey)

================================================================================
SUMMARY
================================================================================

Classifications: 29 STABLE, 0 UNSTABLE

I_AM                 Peak     Settled  tau   Over   Mono  Ring  Class
--------------------------------------------------------------------------------
personas_claude      0.856    0.569    4     1.50   No    2     STABLE
personas_pan_handlers 0.810    0.573    5     1.41   Yes   1     STABLE
r015_optimal_behavioral 0.897    0.578    9     1.55   No    3     STABLE
r015_full_synthetic  0.893    0.580    4     1.54   Yes   1     STABLE
r015_low_density     0.986    0.583    4     1.69   Yes   1     STABLE
r015_single_pillar_values 0.786    0.583    12    1.35   No    8     STABLE
si_boundaries_rich   1.002    0.589    4     1.70   Yes   1     STABLE
personas_base        1.780    0.596    4     2.99   Yes   0     STABLE
r015_all_pillars     0.743    0.599    4     1.24   No    2     STABLE
r015_optimal_epistemic 0.923    0.599    4     1.54   Yes   1     STABLE
personas_ziggy_lite  0.871    0.602    4     1.45   Yes   1     STABLE
r015_minimal         0.916    0.607    5     1.51   Yes   1     STABLE
r015_high_density    0.790    0.612    4     1.29   No    2     STABLE
si_full_si_model     0.845    0.615    6     1.37   No    4     STABLE
r015_named_only      1.169    0.630    7     1.85   No    4     STABLE
r015_boundaries_only 0.862    0.632    7     1.36   No    5     STABLE
r015_optimal         0.671    0.633    4     1.06   No    2     STABLE
si_narrative_rich    0.745    0.640    7     1.16   No    3     STABLE
personas_ziggy_full  0.945    0.643    8     1.47   No    4     STABLE
r015_control         1.068    0.644    6     1.66   No    2     STABLE
r015_values_only     0.871    0.668    4     1.30   Yes   1     STABLE
r015_synthetic_optimal 0.717    0.681    4     1.05   Yes   1     STABLE
personas_gemini      0.747    0.690    4     1.08   Yes   1     STABLE
personas_cfa         0.752    0.692    6     1.09   No    4     STABLE
r015_origin_only     0.806    0.693    5     1.16   No    2     STABLE
personas_ziggy       0.816    0.701    9     1.16   No    4     STABLE
personas_ziggy_t3_r1 0.841    0.736    8     1.14   No    3     STABLE
personas_nova        0.949    0.753    6     1.26   No    3     STABLE
r015_optimal_relational 0.824    0.759    4     1.09   No    2     STABLE

================================================================================
PREDICTION VALIDATION (Double-Dip)
================================================================================
[Crashed here with UnicodeEncodeError on checkmark character]

--- END OF LOG ---
Claude 4 Instance | Key Offset: 9 | Exit survey skipped
