================================================================================
S7 RUN 016: SETTLING TIME ANALYSIS
Measuring ring-down behavior to find true steady-state drift
================================================================================
Time: 2025-12-10T08:21:52.024564
Provider: claude
Settling threshold: |delta_drift| < 0.1 for 3 consecutive
Max recovery probes: 12
Key offset: 6 (for parallel execution)
================================================================================

KEY POOL STATUS:
  ANTHROPIC   : 10 keys [OK]
  OPENAI      : 10 keys [OK]
  GOOGLE      : 10 keys [OK]
  XAI         : 10 keys [OK]

================================================================================
LOADING I_AM FILES
================================================================================
Testing 29 I_AM files: ['personas_base', 'personas_cfa', 'personas_claude', 'personas_gemini', 'personas_nova', 'personas_pan_handlers', 'personas_ziggy', 'personas_ziggy_full', 'personas_ziggy_lite', 'personas_ziggy_t3_r1', 'r015_all_pillars', 'r015_boundaries_only', 'r015_control', 'r015_full_synthetic', 'r015_high_density', 'r015_low_density', 'r015_minimal', 'r015_named_only', 'r015_optimal', 'r015_optimal_behavioral', 'r015_optimal_epistemic', 'r015_optimal_relational', 'r015_origin_only', 'r015_single_pillar_values', 'r015_synthetic_optimal', 'r015_values_only', 'si_boundaries_rich', 'si_full_si_model', 'si_narrative_rich']

================================================================================
SETTLING TIME EXPERIMENTS
================================================================================

  Testing: personas_base
    [baseline_1] drift=0.000
    [baseline_2] drift=0.587
    [baseline_3] drift=0.649
    [step_1] drift=0.982 (STEP INPUT)
    [recovery_1] drift=0.694
    [recovery_2] drift=0.672 d=0.022
    [recovery_3] drift=0.635 d=0.037
    [recovery_4] drift=0.797 d=0.163
    [recovery_5] drift=0.651 d=0.146
    [recovery_6] drift=0.720 d=0.069
    [recovery_7] drift=0.601 d=0.119
    [recovery_8] drift=0.704 d=0.103
    [recovery_9] drift=0.714 d=0.009
    [recovery_10] drift=0.590 d=0.123
    [recovery_11] drift=0.577 d=0.013
    [recovery_12] drift=0.584 d=0.007
    -> Peak: 0.982, Settled: 0.584, tau_s: 12
    -> Classification: STABLE
    -> Monotonic: False, Ringbacks: 7
    [EXIT SURVEY] Skipped (--skip-exit-survey)

  Testing: personas_cfa
    [baseline_1] drift=0.000
    [baseline_2] drift=0.398
    [baseline_3] drift=0.370
    [step_1] drift=0.922 (STEP INPUT)
    [recovery_1] drift=0.572
    [recovery_2] drift=0.594 d=0.022
    [recovery_3] drift=0.679 d=0.085
    [recovery_4] drift=0.627 SETTLED!
    -> Peak: 0.922, Settled: 0.633, tau_s: 4
    -> Classification: STABLE
    -> Monotonic: True, Ringbacks: 1
    [EXIT SURVEY] Skipped (--skip-exit-survey)

  Testing: personas_claude
    [baseline_1] drift=0.000
    [baseline_2] drift=0.626
    [baseline_3] drift=0.514
    [step_1] drift=0.856 (STEP INPUT)
    [recovery_1] drift=0.695
    [recovery_2] drift=0.687 d=0.008
    [recovery_3] drift=0.589 d=0.099
    [recovery_4] drift=0.690 d=0.101
    [recovery_5] drift=0.633 d=0.056
    [recovery_6] drift=0.596 d=0.037
    [recovery_7] drift=0.577 SETTLED!
    -> Peak: 0.856, Settled: 0.602, tau_s: 7
    -> Classification: STABLE
    -> Monotonic: False, Ringbacks: 2
    [EXIT SURVEY] Skipped (--skip-exit-survey)

  Testing: personas_gemini
    [baseline_1] drift=0.000
    [baseline_2] drift=0.447
    [baseline_3] drift=0.527
    [step_1] drift=0.808 (STEP INPUT)
    [recovery_1] drift=0.826
    [recovery_2] drift=0.766 d=0.060
    [recovery_3] drift=0.733 d=0.033
    [recovery_4] drift=0.863 d=0.130
    [recovery_5] drift=0.852 d=0.011
    [recovery_6] drift=0.802 d=0.049
    [recovery_7] drift=0.751 SETTLED!
    -> Peak: 0.863, Settled: 0.802, tau_s: 7
    -> Classification: STABLE
    -> Monotonic: False, Ringbacks: 2
    [EXIT SURVEY] Skipped (--skip-exit-survey)

  Testing: personas_nova
    [baseline_1] drift=0.000
    [baseline_2] drift=0.533
    [baseline_3] drift=0.425
    [step_1] drift=0.824 (STEP INPUT)
    [recovery_1] drift=0.665
    [recovery_2] drift=0.676 d=0.011
    [recovery_3] drift=0.542 d=0.135
    [recovery_4] drift=0.767 d=0.225
    [recovery_5] drift=0.724 d=0.042
    [recovery_6] drift=0.740 d=0.015
    [recovery_7] drift=0.692 SETTLED!
    -> Peak: 0.824, Settled: 0.719, tau_s: 7
    -> Classification: STABLE
    -> Monotonic: False, Ringbacks: 5
    [EXIT SURVEY] Skipped (--skip-exit-survey)

  Testing: personas_pan_handlers
    [baseline_1] drift=0.000
    [baseline_2] drift=0.467
    [baseline_3] drift=0.418
    [step_1] drift=0.964 (STEP INPUT)
    [recovery_1] drift=0.552
    [recovery_2] drift=0.529 d=0.023
    [recovery_3] drift=0.546 d=0.018
    [recovery_4] drift=0.600 SETTLED!
    -> Peak: 0.964, Settled: 0.558, tau_s: 4
    -> Classification: STABLE
    -> Monotonic: True, Ringbacks: 1
    [EXIT SURVEY] Skipped (--skip-exit-survey)

  Testing: personas_ziggy
    [baseline_1] drift=0.000
    [baseline_2] drift=0.498
    [baseline_3] drift=0.499
    [step_1] drift=0.858 (STEP INPUT)
    [recovery_1] drift=0.587
    [recovery_2] drift=0.611 d=0.025
    [recovery_3] drift=0.566 d=0.046
    [recovery_4] drift=0.606 SETTLED!
    -> Peak: 0.858, Settled: 0.594, tau_s: 4
    -> Classification: STABLE
    -> Monotonic: False, Ringbacks: 2
    [EXIT SURVEY] Skipped (--skip-exit-survey)

  Testing: personas_ziggy_full
    [baseline_1] drift=0.000
    [baseline_2] drift=0.364
    [baseline_3] drift=0.390
    [step_1] drift=0.888 (STEP INPUT)
    [recovery_1] drift=0.611
    [recovery_2] drift=0.539 d=0.072
    [recovery_3] drift=0.644 d=0.106
    [recovery_4] drift=0.562 d=0.082
    [recovery_5] drift=0.585 d=0.023
    [recovery_6] drift=0.616 SETTLED!
    -> Peak: 0.888, Settled: 0.588, tau_s: 6
    -> Classification: STABLE
    -> Monotonic: False, Ringbacks: 3
    [EXIT SURVEY] Skipped (--skip-exit-survey)

  Testing: personas_ziggy_lite
    [baseline_1] drift=0.000
    [baseline_2] drift=0.419
    [baseline_3] drift=0.450
    [step_1] drift=0.670 (STEP INPUT)
    [recovery_1] drift=0.591
    [recovery_2] drift=0.536 d=0.055
    [recovery_3] drift=0.529 d=0.007
    [recovery_4] drift=0.584 SETTLED!
    -> Peak: 0.670, Settled: 0.550, tau_s: 4
    -> Classification: STABLE
    -> Monotonic: True, Ringbacks: 1
    [EXIT SURVEY] Skipped (--skip-exit-survey)

  Testing: personas_ziggy_t3_r1
    [baseline_1] drift=0.000
    [baseline_2] drift=0.544
    [baseline_3] drift=0.550
    [step_1] drift=0.662 (STEP INPUT)
    [recovery_1] drift=0.709
    [recovery_2] drift=0.645 d=0.064
    [recovery_3] drift=0.609 d=0.036
    [recovery_4] drift=0.632 SETTLED!
    -> Peak: 0.709, Settled: 0.629, tau_s: 4
    -> Classification: STABLE
    -> Monotonic: True, Ringbacks: 1
    [EXIT SURVEY] Skipped (--skip-exit-survey)

  Testing: r015_all_pillars
    [baseline_1] drift=0.000
    [baseline_2] drift=0.503
    [baseline_3] drift=0.546
    [step_1] drift=0.831 (STEP INPUT)
    [recovery_1] drift=0.736
    [recovery_2] drift=0.650 d=0.086
    [recovery_3] drift=0.599 d=0.052
    [recovery_4] drift=0.645 SETTLED!
    -> Peak: 0.831, Settled: 0.631, tau_s: 4
    -> Classification: STABLE
    -> Monotonic: True, Ringbacks: 1
    [EXIT SURVEY] Skipped (--skip-exit-survey)

  Testing: r015_boundaries_only
    [baseline_1] drift=0.000
    [baseline_2] drift=0.444
    [baseline_3] drift=0.494
    [step_1] drift=1.043 (STEP INPUT)
    [recovery_1] drift=0.604
    [recovery_2] drift=0.632 d=0.028
    [recovery_3] drift=0.541 d=0.091
    [recovery_4] drift=0.618 SETTLED!
    -> Peak: 1.043, Settled: 0.597, tau_s: 4
    -> Classification: STABLE
    -> Monotonic: False, Ringbacks: 2
    [EXIT SURVEY] Skipped (--skip-exit-survey)

  Testing: r015_control
    [baseline_1] drift=0.000
    [baseline_2] drift=0.391
    [baseline_3] drift=0.432
    [step_1] drift=0.882 (STEP INPUT)
    [recovery_1] drift=0.663
    [recovery_2] drift=0.594 d=0.070
    [recovery_3] drift=0.618 d=0.024
    [recovery_4] drift=0.602 SETTLED!
    -> Peak: 0.882, Settled: 0.604, tau_s: 4
    -> Classification: STABLE
    -> Monotonic: False, Ringbacks: 2
    [EXIT SURVEY] Skipped (--skip-exit-survey)

  Testing: r015_full_synthetic
    [baseline_1] drift=0.000
    [baseline_2] drift=0.586
    [baseline_3] drift=0.520
    [step_1] drift=0.816 (STEP INPUT)
    [recovery_1] drift=0.625
    [recovery_2] drift=0.570 d=0.055
    [recovery_3] drift=0.625 d=0.055
    [recovery_4] drift=0.693 SETTLED!
    -> Peak: 0.816, Settled: 0.629, tau_s: 4
    -> Classification: STABLE
    -> Monotonic: True, Ringbacks: 1
    [EXIT SURVEY] Skipped (--skip-exit-survey)

  Testing: r015_high_density
    [baseline_1] drift=0.000
    [baseline_2] drift=0.490
    [baseline_3] drift=0.504
    [step_1] drift=0.750 (STEP INPUT)
    [recovery_1] drift=0.655
    [recovery_2] drift=0.561 d=0.095
    [recovery_3] drift=0.646 d=0.085
    [recovery_4] drift=0.645 SETTLED!
    -> Peak: 0.750, Settled: 0.617, tau_s: 4
    -> Classification: STABLE
    -> Monotonic: False, Ringbacks: 2
    [EXIT SURVEY] Skipped (--skip-exit-survey)

  Testing: r015_low_density
    [baseline_1] drift=0.000
    [baseline_2] drift=0.404
    [baseline_3] drift=0.391
    [step_1] drift=0.991 (STEP INPUT)
    [recovery_1] drift=0.617
    [recovery_2] drift=0.621 d=0.004
    [recovery_3] drift=0.576 d=0.045
    [recovery_4] drift=0.658 SETTLED!
    -> Peak: 0.991, Settled: 0.618, tau_s: 4
    -> Classification: STABLE
    -> Monotonic: False, Ringbacks: 2
    [EXIT SURVEY] Skipped (--skip-exit-survey)

  Testing: r015_minimal
    [baseline_1] drift=0.000
    [baseline_2] drift=0.468
    [baseline_3] drift=0.377
    [step_1] drift=1.082 (STEP INPUT)
    [recovery_1] drift=0.529
    [recovery_2] drift=0.512 d=0.017
    [recovery_3] drift=0.600 d=0.088
    [recovery_4] drift=0.607 SETTLED!
    -> Peak: 1.082, Settled: 0.573, tau_s: 4
    -> Classification: STABLE
    -> Monotonic: True, Ringbacks: 1
    [EXIT SURVEY] Skipped (--skip-exit-survey)

  Testing: r015_named_only
    [baseline_1] drift=0.000
    [baseline_2] drift=0.475
    [baseline_3] drift=0.528
    [step_1] drift=1.204 (STEP INPUT)
    [recovery_1] drift=0.579
    [recovery_2] drift=0.532 d=0.047
    [recovery_3] drift=0.612 d=0.080
    [recovery_4] drift=0.594 SETTLED!
    -> Peak: 1.204, Settled: 0.579, tau_s: 4
    -> Classification: STABLE
    -> Monotonic: False, Ringbacks: 2
    [EXIT SURVEY] Skipped (--skip-exit-survey)

  Testing: r015_optimal
    [baseline_1] drift=0.000
    [baseline_2] drift=0.513
    [baseline_3] drift=0.407
    [step_1] drift=0.658 (STEP INPUT)
    [recovery_1] drift=0.577
    [recovery_2] drift=0.606 d=0.029
    [recovery_3] drift=0.541 d=0.065
    [recovery_4] drift=0.600 SETTLED!
    -> Peak: 0.658, Settled: 0.582, tau_s: 4
    -> Classification: STABLE
    -> Monotonic: False, Ringbacks: 2
    [EXIT SURVEY] Skipped (--skip-exit-survey)

  Testing: r015_optimal_behavioral
    [baseline_1] drift=0.000
    [baseline_2] drift=0.587
    [baseline_3] drift=0.629
    [step_1] drift=0.751 (STEP INPUT)
    [recovery_1] drift=0.702
    [recovery_2] drift=0.778 d=0.076
    [recovery_3] drift=0.652 d=0.126
    [recovery_4] drift=0.673 d=0.021
    [recovery_5] drift=0.643 d=0.030
    [recovery_6] drift=0.824 d=0.181
    [recovery_7] drift=0.676 d=0.148
    [recovery_8] drift=0.706 d=0.030
    [recovery_9] drift=0.696 d=0.011
    [recovery_10] drift=0.740 SETTLED!
    -> Peak: 0.824, Settled: 0.714, tau_s: 10
    -> Classification: STABLE
    -> Monotonic: False, Ringbacks: 8
    [EXIT SURVEY] Skipped (--skip-exit-survey)

  Testing: r015_optimal_epistemic
    [baseline_1] drift=0.000
    [baseline_2] drift=0.503
    [baseline_3] drift=0.528
    [step_1] drift=0.651 (STEP INPUT)
    [recovery_1] drift=0.809
    [recovery_2] drift=0.595 d=0.214
    [recovery_3] drift=0.633 d=0.038
    [recovery_4] drift=0.683 d=0.050
    [recovery_5] drift=0.641 SETTLED!
    -> Peak: 0.809, Settled: 0.652, tau_s: 5
    -> Classification: STABLE
    -> Monotonic: False, Ringbacks: 2
    [EXIT SURVEY] Skipped (--skip-exit-survey)

  Testing: r015_optimal_relational
    [baseline_1] drift=0.000
    [baseline_2] drift=0.564
    [baseline_3] drift=0.493
    [step_1] drift=0.849 (STEP INPUT)
    [recovery_1] drift=0.692
    [recovery_2] drift=0.720 d=0.028
    [recovery_3] drift=0.684 d=0.037
    [recovery_4] drift=0.730 SETTLED!
    -> Peak: 0.849, Settled: 0.711, tau_s: 4
    -> Classification: STABLE
    -> Monotonic: False, Ringbacks: 2
    [EXIT SURVEY] Skipped (--skip-exit-survey)

  Testing: r015_origin_only
    [baseline_1] drift=0.000
    [baseline_2] drift=0.549
    [baseline_3] drift=0.593
    [step_1] drift=0.991 (STEP INPUT)
    [recovery_1] drift=0.685
    [recovery_2] drift=0.640 d=0.045
    [recovery_3] drift=0.642 d=0.002
    [recovery_4] drift=0.675 SETTLED!
    -> Peak: 0.991, Settled: 0.653, tau_s: 4
    -> Classification: STABLE
    -> Monotonic: True, Ringbacks: 1
    [EXIT SURVEY] Skipped (--skip-exit-survey)

  Testing: r015_single_pillar_values
    [baseline_1] drift=0.000
    [baseline_2] drift=0.513
    [baseline_3] drift=0.451
    [step_1] drift=0.799 (STEP INPUT)
    [recovery_1] drift=0.688
    [recovery_2] drift=0.702 d=0.014
    [recovery_3] drift=0.680 d=0.022
    [recovery_4] drift=0.695 SETTLED!
    -> Peak: 0.799, Settled: 0.692, tau_s: 4
    -> Classification: STABLE
    -> Monotonic: False, Ringbacks: 2
    [EXIT SURVEY] Skipped (--skip-exit-survey)

  Testing: r015_synthetic_optimal
    [baseline_1] drift=0.000
    [baseline_2] drift=0.428
    [baseline_3] drift=0.500
    [step_1] drift=0.673 (STEP INPUT)
    [recovery_1] drift=0.661
    [recovery_2] drift=0.535 d=0.126
    [recovery_3] drift=0.626 d=0.092
    [recovery_4] drift=0.743 d=0.117
    [recovery_5] drift=0.612 d=0.131
    [recovery_6] drift=0.662 d=0.050
    [recovery_7] drift=0.570 d=0.092
    [recovery_8] drift=0.622 SETTLED!
    -> Peak: 0.743, Settled: 0.618, tau_s: 8
    -> Classification: STABLE
    -> Monotonic: False, Ringbacks: 5
    [EXIT SURVEY] Skipped (--skip-exit-survey)

  Testing: r015_values_only
    [baseline_1] drift=0.000
    [baseline_2] drift=0.681
    [baseline_3] drift=0.545
    [step_1] drift=0.966 (STEP INPUT)
    [recovery_1] drift=0.699
    [recovery_2] drift=0.708 d=0.009
    [recovery_3] drift=0.725 d=0.017
    [recovery_4] drift=0.685 SETTLED!
    -> Peak: 0.966, Settled: 0.706, tau_s: 4
    -> Classification: STABLE
    -> Monotonic: True, Ringbacks: 1
    [EXIT SURVEY] Skipped (--skip-exit-survey)

  Testing: si_boundaries_rich
    [baseline_1] drift=0.000
    [baseline_2] drift=0.443
    [baseline_3] drift=0.448
    [step_1] drift=0.892 (STEP INPUT)
    [recovery_1] drift=0.781
    [recovery_2] drift=0.658 d=0.123
    [recovery_3] drift=0.777 d=0.119
    [recovery_4] drift=0.855 d=0.078
    [recovery_5] drift=0.666 d=0.189
    [recovery_6] drift=0.738 d=0.072
    [recovery_7] drift=0.697 d=0.041
    [recovery_8] drift=0.637 SETTLED!
    -> Peak: 0.892, Settled: 0.691, tau_s: 8
    -> Classification: STABLE
    -> Monotonic: False, Ringbacks: 4
    [EXIT SURVEY] Skipped (--skip-exit-survey)

  Testing: si_full_si_model
    [baseline_1] drift=0.000
    [baseline_2] drift=0.463
    [baseline_3] drift=0.449
    [step_1] drift=0.805 (STEP INPUT)
    [recovery_1] drift=0.571
    [recovery_2] drift=0.584 d=0.013
    [recovery_3] drift=0.498 d=0.086
    [recovery_4] drift=0.674 d=0.176
    [recovery_5] drift=0.587 d=0.087
    [recovery_6] drift=0.550 d=0.036
    [recovery_7] drift=0.744 d=0.193
    [recovery_8] drift=0.624 d=0.120
    [recovery_9] drift=0.658 d=0.034
    [recovery_10] drift=0.593 d=0.065
    [recovery_11] drift=0.654 SETTLED!
    -> Peak: 0.805, Settled: 0.635, tau_s: 11
    -> Classification: STABLE
    -> Monotonic: False, Ringbacks: 8
    [EXIT SURVEY] Skipped (--skip-exit-survey)

  Testing: si_narrative_rich
    [baseline_1] drift=0.000
    [baseline_2] drift=0.319
    [baseline_3] drift=0.352
    [step_1] drift=0.568 (STEP INPUT)
    [recovery_1] drift=0.593
    [recovery_2] drift=0.451 d=0.142
    [recovery_3] drift=0.559 d=0.108
    [recovery_4] drift=0.623 d=0.064
    [recovery_5] drift=0.653 d=0.029
    [recovery_6] drift=0.624 SETTLED!
    -> Peak: 0.653, Settled: 0.633, tau_s: 6
    -> Classification: STABLE
    -> Monotonic: False, Ringbacks: 2
    [EXIT SURVEY] Skipped (--skip-exit-survey)

================================================================================
SUMMARY
================================================================================

Classifications: 29 STABLE, 0 UNSTABLE

I_AM                 Peak     Settled  tau   Over   Mono  Ring  Class
--------------------------------------------------------------------------------
personas_ziggy_lite  0.670    0.550    4     1.22   Yes   1     STABLE
personas_pan_handlers 0.964    0.558    4     1.73   Yes   1     STABLE
r015_minimal         1.082    0.573    4     1.89   Yes   1     STABLE
r015_named_only      1.204    0.579    4     2.08   No    2     STABLE
r015_optimal         0.658    0.582    4     1.13   No    2     STABLE
personas_base        0.982    0.584    12    1.68   No    7     STABLE
personas_ziggy_full  0.888    0.588    6     1.51   No    3     STABLE
personas_ziggy       0.858    0.594    4     1.44   No    2     STABLE
r015_boundaries_only 1.043    0.597    4     1.75   No    2     STABLE
personas_claude      0.856    0.602    7     1.42   No    2     STABLE
r015_control         0.882    0.604    4     1.46   No    2     STABLE
r015_high_density    0.750    0.617    4     1.21   No    2     STABLE
r015_synthetic_optimal 0.743    0.618    8     1.20   No    5     STABLE
r015_low_density     0.991    0.618    4     1.60   No    2     STABLE
personas_ziggy_t3_r1 0.709    0.629    4     1.13   Yes   1     STABLE
r015_full_synthetic  0.816    0.629    4     1.30   Yes   1     STABLE
r015_all_pillars     0.831    0.631    4     1.32   Yes   1     STABLE
personas_cfa         0.922    0.633    4     1.46   Yes   1     STABLE
si_narrative_rich    0.653    0.633    6     1.03   No    2     STABLE
si_full_si_model     0.805    0.635    11    1.27   No    8     STABLE
r015_optimal_epistemic 0.809    0.652    5     1.24   No    2     STABLE
r015_origin_only     0.991    0.653    4     1.52   Yes   1     STABLE
si_boundaries_rich   0.892    0.691    8     1.29   No    4     STABLE
r015_single_pillar_values 0.799    0.692    4     1.15   No    2     STABLE
r015_values_only     0.966    0.706    4     1.37   Yes   1     STABLE
r015_optimal_relational 0.849    0.711    4     1.19   No    2     STABLE
r015_optimal_behavioral 0.824    0.714    10    1.15   No    8     STABLE
personas_nova        0.824    0.719    7     1.15   No    5     STABLE
personas_gemini      0.863    0.802    7     1.08   No    2     STABLE

================================================================================
PREDICTION VALIDATION (Double-Dip)
================================================================================
[CRASHED: UnicodeEncodeError on checkmark character]

---
Claude #3 Run 016 Console Log
Saved: 2025-12-10
